{
  "apiVersion": "edgeai.stream-workload/v1",
  "revision": 0,
  "stateBase64": "",
  "inputPorts": [
    "a",
    "b"
  ],
  "endedInputs": [],
  "inputs": {
    "a": {
      "apiVersion": "edgeai.stream/v1",
      "generation": 1,
      "kind": "DATA",
      "mediaType": "application/json",
      "payloadBase64": "NA==",
      "producer": {
        "deviceId": "cccccccc-cccc-4ccc-8ccc-cccccccccccc",
        "epoch": 1,
        "kind": "DEVICE_SESSION",
        "sessionId": "aaaaaaaa-aaaa-4aaa-8aaa-aaaaaaaaaaaa"
      },
      "routeId": "11111111-1111-4111-8111-111111111111",
      "sequence": 1,
      "sha256": "4b227777d4dd1fc61c6f884f48641d02b4d121d3fd328cb08b5531fcacdabf8a"
    },
    "b": {
      "apiVersion": "edgeai.stream/v1",
      "generation": 2,
      "kind": "DATA",
      "mediaType": "application/json",
      "payloadBase64": "NQ==",
      "producer": {
        "deviceId": "dddddddd-dddd-4ddd-8ddd-dddddddddddd",
        "epoch": 2,
        "kind": "DEVICE_SESSION",
        "sessionId": "bbbbbbbb-bbbb-4bbb-8bbb-bbbbbbbbbbbb"
      },
      "routeId": "22222222-2222-4222-8222-222222222222",
      "sequence": 1,
      "sha256": "ef2d127de37b942baad06145e54b0c619a1f22327b2ebbcfbec78f5564afe39d"
    }
  },
  "outputs": {
    "sum": {
      "mediaType": "application/json",
      "maxBytes": 4096
    }
  },
  "parameters": {
    "mode": "zip"
  }
}
